[
  {
    "levelValue": 0,
    "url": "https://pixabay.com/images/id/6230092/apple-fruit-red-healthy-sweet-2.jpg",
    "correct": "Apple",
    "incorrects": ["Peach", "Pear"],
    "answerHistory": {
      "correct": 0,
      "incorrect": 0
    },
    "active": true
  },
  {
    "levelValue": 0,
    "url": "https://pixabay.com/images/id/277019/bicycle-bike-cycle-transportation-2.jpg",
    "correct": "Bicycle",
    "incorrects": ["Scooter", "Motorcycle"],
    "answerHistory": {
      "correct": 0,
      "incorrect": 0
    },
    "active": true
  },
  {
    "levelValue": 0,
    "url": "https://pixabay.com/images/id/1121120/book-open-pages-publication-knowledge-2.jpg",
    "correct": "Book",
    "incorrects": ["Magazine", "Newspaper"],
    "answerHistory": {
      "correct": 0,
      "incorrect": 0
    },
    "active": true
  },
  {
    "levelValue": 0,
    "url": "https://pixabay.com/images/id/4285138/bus-vehicle-transportation-yellow-school-2.jpg",
    "correct": "Bus",
    "incorrects": ["Train", "Car"],
    "answerHistory": {
      "correct": 0,
      "incorrect": 0
    },
    "active": true
  },
  {
    "levelValue": 0,
    "url": "https://pixabay.com/images/id/2235183/cat-pet-feline-animal-portrait-2.jpg",
    "correct": "Cat",
    "incorrects": ["Dog", "Rabbit"],
    "answerHistory": {
      "correct": 0,
      "incorrect": 0
    },
    "active": true
  },
  {
    "levelValue": 0,
    "url": "https://pixabay.com/images/id/1817303/chair-furniture-wooden-seat-2.jpg",
    "correct": "Chair",
    "incorrects": ["Table", "Couch"],
    "answerHistory": {
      "correct": 0,
      "incorrect": 0
    },
    "active": true
  },
  {
    "levelValue": 0,
    "url": "https://pixabay.com/images/id/2700745/clock-watch-time-antique-2.jpg",
    "correct": "Clock",
    "incorrects": ["Watch", "Timer"],
    "answerHistory": {
      "correct": 0,
      "incorrect": 0
    },
    "active": true
  },
  {
    "levelValue": 0,
    "correct": "Cloud",
    "incorrects": ["Sky", "Water"],
    "url": "https://pixabay.com/images/id/1581671/cloud-sky-white-fluffy-2.jpg",
    "answerHistory": {
      "correct": 0,
      "incorrect": 0
    }
  },
  {
    "levelValue": 0,
    "url": "https://pixabay.com/images/id/4319248/cup-mug-coffee-ceramic-tea-2.jpg",
    "correct": "Cup",
    "incorrects": ["Mug", "Glass"],
    "answerHistory": {
      "correct": 0,
      "incorrect": 0
    },
    "active": true
  },
  {
    "levelValue": 0,
    "url": "https://pixabay.com/images/id/1200345/door-wooden-door-entrance-knob-2.jpg",
    "correct": "Door",
    "incorrects": ["Window", "Wall"],
    "answerHistory": {
      "correct": 0,
      "incorrect": 0
    },
    "active": true
  },
  {
    "levelValue": 0,
    "url": "https://pixabay.com/images/id/2145373/dress-clothing-fashion-female-2.jpg",
    "correct": "Dress",
    "incorrects": ["Shirt", "Pants"],
    "answerHistory": {
      "correct": 0,
      "incorrect": 0
    },
    "active": true
  },
  {
    "levelValue": 0,
    "url": "https://pixabay.com/images/id/428731/earth-planet-globe-world-2.jpg",
    "correct": "Earth",
    "incorrects": ["Moon", "Sun"],
    "answerHistory": {
      "correct": 0,
      "incorrect": 0
    },
    "active": true
  },
  {
    "levelValue": 0,
    "url": "https://pixabay.com/images/id/1181712/eye-look-see-gaze-2.jpg",
    "correct": "Eye",
    "incorrects": ["Nose", "Ear"],
    "answerHistory": {
      "correct": 0,
      "incorrect": 0
    },
    "active": true
  },
  {
    "levelValue": 0,
    "url": "https://pixabay.com/images/id/1437649/face-human-head-portrait-smile-2.jpg",
    "correct": "Face",
    "incorrects": ["Head", "Hair"],
    "answerHistory": {
      "correct": 0,
      "incorrect": 0
    },
    "active": true
  },
  {
    "levelValue": 0,
    "url": "https://pixabay.com/images/id/2279482/fish-goldfish-underwater-water-2.jpg",
    "correct": "Fish",
    "incorrects": ["Shark", "Whale"],
    "answerHistory": {
      "correct": 0,
      "incorrect": 0
    },
    "active": true
  },
  {
    "levelValue": 0,
    "url": "https://pixabay.com/images/id/1463387/flower-bloom-blossom-nature-2.jpg",
    "correct": "Flower",
    "incorrects": ["Plant", "Tree"],
    "answerHistory": {
      "correct": 0,
      "incorrect": 0
    },
    "active": true
  },
  {
    "levelValue": 0,
    "url": "https://pixabay.com/images/id/1817331/fork-cutlery-silverware-utensil-2.jpg",
    "correct": "Fork",
    "incorrects": ["Spoon", "Knife"],
    "answerHistory": {
      "correct": 0,
      "incorrect": 0
    },
    "active": true
  },
  {
    "levelValue": 0,
    "url": "https://pixabay.com/images/id/844358/frog-amphibian-animal-green-2.jpg",
    "correct": "Frog",
    "incorrects": ["Toad", "Lizard"],
    "answerHistory": {
      "correct": 0,
      "incorrect": 0
    },
    "active": true
  },
  {
    "levelValue": 0,
    "url": "https://pixabay.com/images/id/1680460/dog-pet-canine-golden-retriever-2.jpg",
    "correct": "Dog",
    "incorrects": ["Cat", "Horse"],
    "answerHistory": {
      "correct": 0,
      "incorrect": 0
    },
    "active": true
  },
  {
    "levelValue": 0,
    "url": "https://pixabay.com/images/id/1437151/chair-furniture-wooden-seat-2.jpg",
    "correct": "Chair",
    "incorrects": ["Table", "Couch"],
    "answerHistory": {
      "correct": 0,
      "incorrect": 0
    },
    "active": true
  },
  {
    "levelValue": 0,
    "url": "https://pixabay.com/images/id/4283374/clock-time-pocket-watch-antique-2.jpg",
    "correct": "Clock",
    "incorrects": ["Watch", "Timer"],
    "answerHistory": {
      "correct": 0,
      "incorrect": 0
    },
    "active": true
  },
  {
    "levelValue": 0,
    "correct": "Cloud",
    "incorrects": ["Sky", "Water"],
    "url": "https://pixabay.com/images/id/1581671/cloud-sky-white-fluffy-2.jpg",
    "answerHistory": {
      "correct": 0,
      "incorrect": 0
    }
  },
  {
    "levelValue": 0,
    "url": "https://pixabay.com/images/id/4319248/cup-mug-coffee-ceramic-tea-2.jpg",
    "correct": "Cup",
    "incorrects": ["Mug", "Glass"],
    "answerHistory": {
      "correct": 0,
      "incorrect": 0
    },
    "active": true
  },
  {
    "levelValue": 0,
    "url": "https://pixabay.com/images/id/1200345/door-wooden-door-entrance-knob-2.jpg",
    "correct": "Door",
    "incorrects": ["Window", "Wall"],
    "answerHistory": {
      "correct": 0,
      "incorrect": 0
    },
    "active": true
  },
  {
    "levelValue": 0,
    "url": "https://pixabay.com/images/id/2145373/dress-clothing-fashion-female-2.jpg",
    "correct": "Dress",
    "incorrects": ["Shirt", "Pants"],
    "answerHistory": {
      "correct": 0,
      "incorrect": 0
    },
    "active": true
  },
  {
    "levelValue": 0,
    "url": "https://pixabay.com/images/id/428731/earth-planet-globe-world-2.jpg",
    "correct": "Earth",
    "incorrects": ["Moon", "Sun"],
    "answerHistory": {
      "correct": 0,
      "incorrect": 0
    },
    "active": true
  },
  {
    "levelValue": 0,
    "url": "https://pixabay.com/images/id/1181712/eye-look-see-gaze-2.jpg",
    "correct": "Eye",
    "incorrects": ["Nose", "Ear"],
    "answerHistory": {
      "correct": 0,
      "incorrect": 0
    },
    "active": true
  },
  {
    "levelValue": 0,
    "url": "https://pixabay.com/images/id/1437649/face-human-head-portrait-smile-2.jpg",
    "correct": "Face",
    "incorrects": ["Head", "Hair"],
    "answerHistory": {
      "correct": 0,
      "incorrect": 0
    },
    "active": true
  },
  {
    "levelValue": 0,
    "url": "https://pixabay.com/images/id/2279482/fish-goldfish-underwater-water-2.jpg",
    "correct": "Fish",
    "incorrects": ["Shark", "Whale"],
    "answerHistory": {
      "correct": 0,
      "incorrect": 0
    },
    "active": true
  },
  {
    "levelValue": 0,
    "url": "https://pixabay.com/images/id/1463387/flower-bloom-blossom-nature-2.jpg",
    "correct": "Flower",
    "incorrects": ["Plant", "Tree"],
    "answerHistory": {
      "correct": 0,
      "incorrect": 0
    },
    "active": true
  },
  {
    "levelValue": 0,
    "url": "https://pixabay.com/images/id/1817331/fork-cutlery-silverware-utensil-2.jpg",
    "correct": "Fork",
    "incorrects": ["Spoon", "Knife"],
    "answerHistory": {
      "correct": 0,
      "incorrect": 0
    },
    "active": true
  },
  {
    "levelValue": 0,
    "url": "https://pixabay.com/images/id/844358/frog-amphibian-animal-green-2.jpg",
    "correct": "Frog",
    "incorrects": ["Toad", "Lizard"],
    "answerHistory": {
      "correct": 0,
      "incorrect": 0
    },
    "active": true
  },
  {
    "levelValue": 0,
    "url": "https://pixabay.com/images/id/1047334/hand-human-body-arm-fingers-2.jpg",
    "correct": "Hand",
    "incorrects": ["Arm", "Leg"],
    "answerHistory": {
      "correct": 0,
      "incorrect": 0
    },
    "active": true
  },
  {
    "levelValue": 0,
    "url": "https://pixabay.com/images/id/2235266/hat-accessory-clothing-fashion-2.jpg",
    "correct": "Hat",
    "incorrects": ["Shirt", "Shoes"],
    "answerHistory": {
      "correct": 0,
      "incorrect": 0
    },
    "active": true
  },
  {
    "levelValue": 0,
    "url": "https://pixabay.com/images/id/2487302/house-building-home-residential-2.jpg",
    "correct": "House",
    "incorrects": ["Building", "School"],
    "answerHistory": {
      "correct": 0,
      "incorrect": 0
    },
    "active": true
  },
  {
    "levelValue": 0,
    "url": "https://pixabay.com/images/id/1181428/ice-cream-food-dessert-sweet-2.jpg",
    "correct": "Ice Cream",
    "incorrects": ["Cake", "Candy"],
    "answerHistory": {
      "correct": 0,
      "incorrect": 0
    },
    "active": true
  },
  {
    "levelValue": 0,
    "url": "https://pixabay.com/images/id/1493073/key-lock-open-door-security-2.jpg",
    "correct": "Key",
    "incorrects": ["Lock", "Handle"],
    "answerHistory": {
      "correct": 0,
      "incorrect": 0
    },
    "active": true
  },
  {
    "levelValue": 0,
    "url": "https://pixabay.com/images/id/1244250/knife-cutlery-silverware-kitchen-2.jpg",